{
  "department": "cooking",
  "name": "دپارتمان پخت",
  "sub_units": [
    { "name": "آشپزخانهٔ گرم", "description": "تهیهٔ غذاهای اصلی و گرم منو" },
    { "name": "واحد کنترل کیفیت", "description": "بررسی سلامت و کیفیت مواد و غذای آماده" }
  ],
  "personnel": [
    { "role": "سرآشپز", "duties": ["مدیریت آشپزخانه", "کنترل کیفیت نهایی غذا"] },
    { "role": "کمک‌آشپز", "duties": ["آماده‌سازی مواد"] }
  ],
  "updated_at": "2026-07-06T10:00:00Z"
}
